property,label,domain,range,comment
http://iec.ch/TC57/2013/CIM-schema-cim16#CsConverter.ratedIdc,ratedIdc,http://iec.ch/TC57/2013/CIM-schema-cim16#CsConverter,http://www.w3.org/2001/XMLSchema#double,"Rated converter DC current, also called IdN. The attribute shall be a positive value. It is converter’s configuration data used in power flow."
http://iec.ch/TC57/2013/CIM-schema-cim16#ThermalGeneratingUnit.CogenerationPlant,CogenerationPlant,http://iec.ch/TC57/2013/CIM-schema-cim16#ThermalGeneratingUnit,http://iec.ch/TC57/2013/CIM-schema-cim16#CogenerationPlant,A thermal generating unit may be a member of a cogeneration plant.
http://iec.ch/TC57/2013/CIM-schema-cim16#CurveData.y2value,y2value,http://iec.ch/TC57/2013/CIM-schema-cim16#CurveData,http://www.w3.org/2001/XMLSchema#double,"The data value of the second Y-axis variable (if present), depending on the Y-axis units."
http://iec.ch/TC57/2013/CIM-schema-cim16#DCLineSegment.length,length,http://iec.ch/TC57/2013/CIM-schema-cim16#DCLineSegment,http://www.w3.org/2001/XMLSchema#double,Segment length for calculating line section capabilities.
http://iec.ch/TC57/2013/CIM-schema-cim16#NonConformLoad.LoadGroup,LoadGroup,http://iec.ch/TC57/2013/CIM-schema-cim16#NonConformLoad,http://iec.ch/TC57/2013/CIM-schema-cim16#NonConformLoadGroup,Group of this ConformLoad.
http://iec.ch/TC57/2013/CIM-schema-cim16#EquivalentShunt.g,g,http://iec.ch/TC57/2013/CIM-schema-cim16#EquivalentShunt,http://www.w3.org/2001/XMLSchema#double,Positive sequence shunt conductance.
http://iec.ch/TC57/2013/CIM-schema-cim16#BasicIntervalSchedule.value2Unit,value2Unit,http://iec.ch/TC57/2013/CIM-schema-cim16#BasicIntervalSchedule,http://www.w3.org/2001/XMLSchema#string,Value2 units of measure.
http://iec.ch/TC57/2013/CIM-schema-cim16#Equipment.normallyInService,normallyInService,http://iec.ch/TC57/2013/CIM-schema-cim16#Equipment,http://www.w3.org/2001/XMLSchema#boolean,"Specifies the availability of the equipment under normal operating conditions. True means the equipment is available for topology processing, which determines if the equipment is energized or not. False means that the equipment is treated by network applications as if it is not in the model."
http://iec.ch/TC57/2013/CIM-schema-cim16#RegularTimePoint.IntervalSchedule,IntervalSchedule,http://iec.ch/TC57/2013/CIM-schema-cim16#RegularTimePoint,http://iec.ch/TC57/2013/CIM-schema-cim16#RegularIntervalSchedule,Regular interval schedule containing this time point.
http://iec.ch/TC57/2013/CIM-schema-cim16#DCConductingEquipment.ratedUdc,ratedUdc,http://iec.ch/TC57/2013/CIM-schema-cim16#DCConductingEquipment,http://www.w3.org/2001/XMLSchema#double,Rated DC device voltage. The attribute shall be a positive value. It is configuration data used in power flow.
http://iec.ch/TC57/2013/CIM-schema-cim16#PowerTransformerEnd.x,x,http://iec.ch/TC57/2013/CIM-schema-cim16#PowerTransformerEnd,http://www.w3.org/2001/XMLSchema#double,Positive sequence series reactance (star-model) of the transformer end.
http://iec.ch/TC57/2013/CIM-schema-cim16#TapChangerTablePoint.ratio,ratio,http://iec.ch/TC57/2013/CIM-schema-cim16#TapChangerTablePoint,http://www.w3.org/2001/XMLSchema#double,"The voltage at the tap step divided by rated voltage of the transformer end having the tap changer. Hence this is a value close to one.
For example, if the ratio at step 1 is 1.01, and the rated voltage of the transformer end is 110kV, then the voltage obtained by setting the tap changer to step 1 to is 111.1kV."
http://iec.ch/TC57/2013/CIM-schema-cim16#TapChanger.neutralU,neutralU,http://iec.ch/TC57/2013/CIM-schema-cim16#TapChanger,http://www.w3.org/2001/XMLSchema#double,"Voltage at which the winding operates at the neutral tap setting. It is the voltage at the terminal of the PowerTransformerEnd associated with the tap changer when all tap changers on the transformer are at their neutralStep position.  Normally neutralU of the tap changer is the same as ratedU of the PowerTransformerEnd, but it can differ in special cases such as when the tapping mechanism is separate from the winding more common on lower voltage transformers.
This attribute is not relevant for PhaseTapChangerAsymmetrical, PhaseTapChangerSymmetrical and PhaseTapChangerLinear. "
http://iec.ch/TC57/2013/CIM-schema-cim16#BatteryUnit.ratedE,ratedE,http://iec.ch/TC57/2013/CIM-schema-cim16#BatteryUnit,http://www.w3.org/2001/XMLSchema#double,Full energy storage capacity of the battery. The attribute shall be a positive value.
http://iec.ch/TC57/2013/CIM-schema-cim16#VoltageLevel.lowVoltageLimit,lowVoltageLimit,http://iec.ch/TC57/2013/CIM-schema-cim16#VoltageLevel,http://www.w3.org/2001/XMLSchema#double,"The bus bar's low voltage limit.
The limit applies to all equipment and nodes contained in a given VoltageLevel. It is not required that it is exchanged in pair with highVoltageLimit. It is preferable to use operational VoltageLimit, which prevails, if present."
http://iec.ch/TC57/2013/CIM-schema-cim16#EquivalentInjection.regulationCapability,regulationCapability,http://iec.ch/TC57/2013/CIM-schema-cim16#EquivalentInjection,http://www.w3.org/2001/XMLSchema#boolean,Specifies whether or not the EquivalentInjection has the capability to regulate the local voltage. If true the EquivalentInjection can regulate. If false the EquivalentInjection cannot regulate. ReactiveCapabilityCurve can only be associated with EquivalentInjection  if the flag is true.
http://iec.ch/TC57/2013/CIM-schema-cim16#TapChanger.TapChangerControl,TapChangerControl,http://iec.ch/TC57/2013/CIM-schema-cim16#TapChanger,http://iec.ch/TC57/2013/CIM-schema-cim16#TapChangerControl,The regulating control scheme in which this tap changer participates.
http://iec.ch/TC57/2013/CIM-schema-cim16#SeasonDayTypeSchedule.Season,Season,http://iec.ch/TC57/2013/CIM-schema-cim16#SeasonDayTypeSchedule,http://iec.ch/TC57/2013/CIM-schema-cim16#Season,Season for the Schedule.
http://iec.ch/TC57/2013/CIM-schema-cim16#OperationalLimit.OperationalLimitType,OperationalLimitType,http://iec.ch/TC57/2013/CIM-schema-cim16#OperationalLimit,http://iec.ch/TC57/2013/CIM-schema-cim16#OperationalLimitType,The limit type associated with this limit.
http://iec.ch/TC57/2013/CIM-schema-cim16#ACLineSegment.x,x,http://iec.ch/TC57/2013/CIM-schema-cim16#ACLineSegment,http://www.w3.org/2001/XMLSchema#double,Positive sequence series reactance of the entire line section.
http://iec.ch/TC57/2013/CIM-schema-cim16#GeneratingUnit.longPF,longPF,http://iec.ch/TC57/2013/CIM-schema-cim16#GeneratingUnit,http://www.w3.org/2001/XMLSchema#double,Generating unit long term economic participation factor.
http://iec.ch/TC57/2013/CIM-schema-cim16#BoundaryPoint.toEndIsoCode,toEndIsoCode,http://iec.ch/TC57/2013/CIM-schema-cim16#BoundaryPoint,http://www.w3.org/2001/XMLSchema#string,"The ISO code of the region which the ""To"" side of the Boundary point belongs to or is connected to.
The ISO code is a two-character country code as defined by ISO 3166 (http://www.iso.org/iso/country_codes). The length of the string is 2 characters maximum."
http://iec.ch/TC57/2013/CIM-schema-cim16#ACDCConverter.ratedUdc,ratedUdc,http://iec.ch/TC57/2013/CIM-schema-cim16#ACDCConverter,http://www.w3.org/2001/XMLSchema#double,"Rated converter DC voltage, also called UdN. The attribute shall be a positive value. It is converter’s configuration data used in power flow. For instance a bipolar HVDC link with value  200 kV has a 400kV difference between the dc lines."
http://iec.ch/TC57/2013/CIM-schema-cim16#ACLineSegment.r,r,http://iec.ch/TC57/2013/CIM-schema-cim16#ACLineSegment,http://www.w3.org/2001/XMLSchema#double,Positive sequence series resistance of the entire line section.
http://iec.ch/TC57/2013/CIM-schema-cim16#OperationalLimitType.kind,kind,http://iec.ch/TC57/2013/CIM-schema-cim16#OperationalLimitType,http://www.w3.org/2001/XMLSchema#string,Types of limits defined in the ENTSO-E Operational Handbook Policy 3.
http://iec.ch/TC57/2013/CIM-schema-cim16#ACDCConverter.resistiveLoss,resistiveLoss,http://iec.ch/TC57/2013/CIM-schema-cim16#ACDCConverter,http://www.w3.org/2001/XMLSchema#double,It is converter’s configuration data used in power flow. Refer to poleLossP. The attribute shall be a positive value.
http://iec.ch/TC57/2013/CIM-schema-cim16#SynchronousMachine.minQ,minQ,http://iec.ch/TC57/2013/CIM-schema-cim16#SynchronousMachine,http://www.w3.org/2001/XMLSchema#double,Minimum reactive power limit for the unit.
http://iec.ch/TC57/2013/CIM-schema-cim16#PhaseTapChangerAsymmetrical.windingConnectionAngle,windingConnectionAngle,http://iec.ch/TC57/2013/CIM-schema-cim16#PhaseTapChangerAsymmetrical,http://www.w3.org/2001/XMLSchema#double,The phase angle between the in-phase winding and the out-of -phase winding used for creating phase shift. The out-of-phase winding produces what is known as the difference voltage.  Setting this angle to 90 degrees is not the same as a symmetrical transformer. The attribute can only be multiples of 30 degrees.  The allowed range is -150 degrees to 150 degrees excluding 0.
http://iec.ch/TC57/2013/CIM-schema-cim16#BoundaryPoint.fromEndNameTso,fromEndNameTso,http://iec.ch/TC57/2013/CIM-schema-cim16#BoundaryPoint,http://www.w3.org/2001/XMLSchema#string,"Identifies the name of the transmission system operator, distribution system operator or other entity at which the ""From"" side of the interconnection is connected to. The length of the string is 64 characters maximum."
http://iec.ch/TC57/2013/CIM-schema-cim16#RotatingMachine.ratedU,ratedU,http://iec.ch/TC57/2013/CIM-schema-cim16#RotatingMachine,http://www.w3.org/2001/XMLSchema#double,"Rated voltage (nameplate data, Ur in IEC 60909-0). It is primarily used for short circuit data exchange according to IEC 60909.
The attribute shall be a positive value."
http://iec.ch/TC57/2013/CIM-schema-cim16#VoltageLimit.normalValue,normalValue,http://iec.ch/TC57/2013/CIM-schema-cim16#VoltageLimit,http://www.w3.org/2001/XMLSchema#double,The normal limit on voltage. High or low limit nature of the limit depends upon the properties of the operational limit type. The attribute shall be a positive value or zero.
http://iec.ch/TC57/2013/CIM-schema-cim16#RatioTapChangerTablePoint.RatioTapChangerTable,RatioTapChangerTable,http://iec.ch/TC57/2013/CIM-schema-cim16#RatioTapChangerTablePoint,http://iec.ch/TC57/2013/CIM-schema-cim16#RatioTapChangerTable,Table of this point.
http://iec.ch/TC57/2013/CIM-schema-cim16#RegularTimePoint.sequenceNumber,sequenceNumber,http://iec.ch/TC57/2013/CIM-schema-cim16#RegularTimePoint,http://www.w3.org/2001/XMLSchema#integer,"The position of the regular time point in the sequence. Note that time points don't have to be sequential, i.e. time points may be omitted. The actual time for a RegularTimePoint is computed by multiplying the associated regular interval schedule's time step with the regular time point sequence number and adding the associated schedules start time. To specify values for the start time, use sequence number 0.  The sequence number cannot be negative."
http://iec.ch/TC57/2013/CIM-schema-cim16#LoadResponseCharacteristic.pVoltageExponent,pVoltageExponent,http://iec.ch/TC57/2013/CIM-schema-cim16#LoadResponseCharacteristic,http://www.w3.org/2001/XMLSchema#double,Exponent of per unit voltage effecting real power.
http://iec.ch/TC57/2013/CIM-schema-cim16#ACDCConverterDCTerminal.DCConductingEquipment,DCConductingEquipment,http://iec.ch/TC57/2013/CIM-schema-cim16#ACDCConverterDCTerminal,http://iec.ch/TC57/2013/CIM-schema-cim16#ACDCConverter,A DC converter terminal belong to an DC converter.
http://iec.ch/TC57/2013/CIM-schema-cim16#OperationalLimitSet.Terminal,Terminal,http://iec.ch/TC57/2013/CIM-schema-cim16#OperationalLimitSet,http://iec.ch/TC57/2013/CIM-schema-cim16#ACDCTerminal,The terminal where the operational limit set apply.
http://iec.ch/TC57/2013/CIM-schema-cim16#SeriesCompensator.r,r,http://iec.ch/TC57/2013/CIM-schema-cim16#SeriesCompensator,http://www.w3.org/2001/XMLSchema#double,Positive sequence resistance.
http://iec.ch/TC57/2013/CIM-schema-cim16#ACLineSegment.bch,bch,http://iec.ch/TC57/2013/CIM-schema-cim16#ACLineSegment,http://www.w3.org/2001/XMLSchema#double,"Positive sequence shunt (charging) susceptance, uniformly distributed, of the entire line section.  This value represents the full charging over the full length of the line."
http://iec.ch/TC57/2013/CIM-schema-cim16#BasicIntervalSchedule.startTime,startTime,http://iec.ch/TC57/2013/CIM-schema-cim16#BasicIntervalSchedule,https://schema.org/DateTime,"The time for the first time point.  The value can be a time of day, not a specific date."
http://iec.ch/TC57/2013/CIM-schema-cim16#EquivalentInjection.minQ,minQ,http://iec.ch/TC57/2013/CIM-schema-cim16#EquivalentInjection,http://www.w3.org/2001/XMLSchema#double,Minimum reactive power of the injection.  Used for modelling of infeed for load flow exchange. Not used for short circuit modelling.  If maxQ and minQ are not used ReactiveCapabilityCurve can be used.
http://iec.ch/TC57/2013/CIM-schema-cim16#LoadResponseCharacteristic.pConstantCurrent,pConstantCurrent,http://iec.ch/TC57/2013/CIM-schema-cim16#LoadResponseCharacteristic,http://www.w3.org/2001/XMLSchema#double,Portion of active power load modelled as constant current.
http://iec.ch/TC57/2013/CIM-schema-cim16#EquivalentShunt.b,b,http://iec.ch/TC57/2013/CIM-schema-cim16#EquivalentShunt,http://www.w3.org/2001/XMLSchema#double,Positive sequence shunt susceptance.
http://iec.ch/TC57/2013/CIM-schema-cim16#TapChanger.ltcFlag,ltcFlag,http://iec.ch/TC57/2013/CIM-schema-cim16#TapChanger,http://www.w3.org/2001/XMLSchema#boolean,Specifies whether or not a TapChanger has load tap changing capabilities.
http://iec.ch/TC57/2013/CIM-schema-cim16#ExternalNetworkInjection.minQ,minQ,http://iec.ch/TC57/2013/CIM-schema-cim16#ExternalNetworkInjection,http://www.w3.org/2001/XMLSchema#double,Minimum reactive power limit. It is used for modelling of infeed for load flow exchange and not for short circuit modelling.
http://iec.ch/TC57/2013/CIM-schema-cim16#TapChangerTablePoint.b,b,http://iec.ch/TC57/2013/CIM-schema-cim16#TapChangerTablePoint,http://www.w3.org/2001/XMLSchema#double,"The magnetizing branch susceptance deviation as a percentage of nominal value. The actual susceptance is calculated as follows:
calculated magnetizing susceptance = b(nominal) * (1 + b(from this class)/100).   The b(nominal) is defined as the static magnetizing susceptance on the associated power transformer end or ends.  This model assumes the star impedance (pi model) form."
http://iec.ch/TC57/2013/CIM-schema-cim16#ACDCTerminal.BusNameMarker,BusNameMarker,http://iec.ch/TC57/2013/CIM-schema-cim16#ACDCTerminal,http://iec.ch/TC57/2013/CIM-schema-cim16#BusNameMarker,The bus name marker used to name the bus (topological node).
http://iec.ch/TC57/2013/CIM-schema-cim16#RegulatingControl.mode,mode,http://iec.ch/TC57/2013/CIM-schema-cim16#RegulatingControl,http://www.w3.org/2001/XMLSchema#string,The regulating control mode presently available.  This specification allows for determining the kind of regulation without need for obtaining the units from a schedule.
http://iec.ch/TC57/2013/CIM-schema-cim16#PhaseTapChangerNonLinear.xMax,xMax,http://iec.ch/TC57/2013/CIM-schema-cim16#PhaseTapChangerNonLinear,http://www.w3.org/2001/XMLSchema#double,"The reactance depends on the tap position according to a ""u"" shaped curve. The maximum reactance (xMax) appears at the low and high tap positions. Depending on the “u” curve the attribute can be either higher or lower than PowerTransformerEnd.x."
http://iec.ch/TC57/2013/CIM-schema-cim16#LoadResponseCharacteristic.pConstantPower,pConstantPower,http://iec.ch/TC57/2013/CIM-schema-cim16#LoadResponseCharacteristic,http://www.w3.org/2001/XMLSchema#double,Portion of active power load modelled as constant power.
http://iec.ch/TC57/2013/CIM-schema-cim16#GeneratingUnit.minOperatingP,minOperatingP,http://iec.ch/TC57/2013/CIM-schema-cim16#GeneratingUnit,http://www.w3.org/2001/XMLSchema#double,This is the minimum operating active power limit the dispatcher can enter for this unit.
http://iec.ch/TC57/2013/CIM-schema-cim16#SeasonDayTypeSchedule.DayType,DayType,http://iec.ch/TC57/2013/CIM-schema-cim16#SeasonDayTypeSchedule,http://iec.ch/TC57/2013/CIM-schema-cim16#DayType,DayType for the Schedule.
http://iec.ch/TC57/2013/CIM-schema-cim16#IdentifiedObject.energyIdentCodeEic,energyIdentCodeEic,http://iec.ch/TC57/2013/CIM-schema-cim16#IdentifiedObject,http://www.w3.org/2001/XMLSchema#string,The attribute is used for an exchange of the EIC code (Energy identification Code). The length of the string is 16 characters as defined by the EIC code. For details on EIC scheme please refer to ENTSO-E web site.
http://iec.ch/TC57/2013/CIM-schema-cim16#ACDCConverter.PccTerminal,PccTerminal,http://iec.ch/TC57/2013/CIM-schema-cim16#ACDCConverter,http://iec.ch/TC57/2013/CIM-schema-cim16#Terminal,Point of common coupling terminal for this converter DC side. It is typically the terminal on the power transformer (or switch) closest to the AC network.
http://iec.ch/TC57/2013/CIM-schema-cim16#BusNameMarker.ReportingGroup,ReportingGroup,http://iec.ch/TC57/2013/CIM-schema-cim16#BusNameMarker,http://iec.ch/TC57/2013/CIM-schema-cim16#ReportingGroup,The reporting group to which this bus name marker belongs.
http://iec.ch/TC57/2013/CIM-schema-cim16#EquivalentBranch.r,r,http://iec.ch/TC57/2013/CIM-schema-cim16#EquivalentBranch,http://www.w3.org/2001/XMLSchema#double,Positive sequence series resistance of the reduced branch.
http://iec.ch/TC57/2013/CIM-schema-cim16#DCSeriesDevice.resistance,resistance,http://iec.ch/TC57/2013/CIM-schema-cim16#DCSeriesDevice,http://www.w3.org/2001/XMLSchema#double,Resistance of the DC device.
http://iec.ch/TC57/2013/CIM-schema-cim16#PhaseTapChanger.TransformerEnd,TransformerEnd,http://iec.ch/TC57/2013/CIM-schema-cim16#PhaseTapChanger,http://iec.ch/TC57/2013/CIM-schema-cim16#TransformerEnd,Transformer end to which this phase tap changer belongs.
http://iec.ch/TC57/2013/CIM-schema-cim16#ExternalNetworkInjection.governorSCD,governorSCD,http://iec.ch/TC57/2013/CIM-schema-cim16#ExternalNetworkInjection,http://www.w3.org/2001/XMLSchema#double,Power Frequency Bias. This is the change in power injection divided by the change in frequency and negated.  A positive value of the power frequency bias provides additional power injection upon a drop in frequency.
http://iec.ch/TC57/2013/CIM-schema-cim16#ThermalGeneratingUnit.CombinedCyclePlant,CombinedCyclePlant,http://iec.ch/TC57/2013/CIM-schema-cim16#ThermalGeneratingUnit,http://iec.ch/TC57/2013/CIM-schema-cim16#CombinedCyclePlant,A thermal generating unit may be a member of a combined cycle plant.
http://iec.ch/TC57/2013/CIM-schema-cim16#ControlArea.EnergyArea,EnergyArea,http://iec.ch/TC57/2013/CIM-schema-cim16#ControlArea,http://iec.ch/TC57/2013/CIM-schema-cim16#EnergyArea,The energy area that is forecast from this control area specification.
http://iec.ch/TC57/2013/CIM-schema-cim16#SynchronousMachine.type,type,http://iec.ch/TC57/2013/CIM-schema-cim16#SynchronousMachine,http://www.w3.org/2001/XMLSchema#string,Modes that this synchronous machine can operate in.
http://iec.ch/TC57/2013/CIM-schema-cim16#StaticVarCompensator.slope,slope,http://iec.ch/TC57/2013/CIM-schema-cim16#StaticVarCompensator,http://www.w3.org/2001/XMLSchema#double,"The characteristics slope of an SVC defines how the reactive power output changes in proportion to the difference between the regulated bus voltage and the voltage setpoint.
The attribute shall be a positive value or zero."
http://iec.ch/TC57/2013/CIM-schema-cim16#EquivalentBranch.r21,r21,http://iec.ch/TC57/2013/CIM-schema-cim16#EquivalentBranch,http://www.w3.org/2001/XMLSchema#double,"Resistance from terminal sequence 2 to terminal sequence 1 .Used for steady state power flow. This attribute is optional and represent unbalanced network such as off-nominal phase shifter. If only EquivalentBranch.r is given, then EquivalentBranch.r21 is assumed equal to EquivalentBranch.r.
Usage rule : EquivalentBranch is a result of network reduction prior to the data exchange."
http://iec.ch/TC57/2013/CIM-schema-cim16#PowerElectronicsConnection.maxQ,maxQ,http://iec.ch/TC57/2013/CIM-schema-cim16#PowerElectronicsConnection,http://www.w3.org/2001/XMLSchema#double,Maximum reactive power limit. This is the maximum (nameplate) limit for the unit.
http://iec.ch/TC57/2013/CIM-schema-cim16#ConnectivityNode.ConnectivityNodeContainer,ConnectivityNodeContainer,http://iec.ch/TC57/2013/CIM-schema-cim16#ConnectivityNode,http://iec.ch/TC57/2013/CIM-schema-cim16#ConnectivityNodeContainer,Container of this connectivity node.
http://iec.ch/TC57/2013/CIM-schema-cim16#ApparentPowerLimit.normalValue,normalValue,http://iec.ch/TC57/2013/CIM-schema-cim16#ApparentPowerLimit,http://www.w3.org/2001/XMLSchema#double,The normal apparent power limit. The attribute shall be a positive value or zero.
http://iec.ch/TC57/2013/CIM-schema-cim16#DCLineSegment.inductance,inductance,http://iec.ch/TC57/2013/CIM-schema-cim16#DCLineSegment,http://www.w3.org/2001/XMLSchema#double,Inductance of the DC line segment. Negligible compared with DCSeriesDevice used for smoothing.
http://iec.ch/TC57/2013/CIM-schema-cim16#TapChangerTablePoint.r,r,http://iec.ch/TC57/2013/CIM-schema-cim16#TapChangerTablePoint,http://www.w3.org/2001/XMLSchema#double,"The resistance deviation as a percentage of nominal value. The actual reactance is calculated as follows:
calculated resistance = r(nominal) * (1 + r(from this class)/100).   The r(nominal) is defined as the static resistance on the associated power transformer end or ends.  This model assumes the star impedance (pi model) form."
http://iec.ch/TC57/2013/CIM-schema-cim16#ShuntCompensator.maximumSections,maximumSections,http://iec.ch/TC57/2013/CIM-schema-cim16#ShuntCompensator,http://www.w3.org/2001/XMLSchema#integer,The maximum number of sections that may be switched in. 
http://iec.ch/TC57/2013/CIM-schema-cim16#SolarGeneratingUnit.SolarPowerPlant,SolarPowerPlant,http://iec.ch/TC57/2013/CIM-schema-cim16#SolarGeneratingUnit,http://iec.ch/TC57/2013/CIM-schema-cim16#SolarPowerPlant,A solar power plant may have solar generating units.
http://iec.ch/TC57/2013/CIM-schema-cim16#ConformLoadSchedule.ConformLoadGroup,ConformLoadGroup,http://iec.ch/TC57/2013/CIM-schema-cim16#ConformLoadSchedule,http://iec.ch/TC57/2013/CIM-schema-cim16#ConformLoadGroup,The ConformLoadGroup where the ConformLoadSchedule belongs.
http://iec.ch/TC57/2013/CIM-schema-cim16#StaticVarCompensator.capacitiveRating,capacitiveRating,http://iec.ch/TC57/2013/CIM-schema-cim16#StaticVarCompensator,http://www.w3.org/2001/XMLSchema#double,Capacitive reactance at maximum capacitive reactive power.  Shall always be positive.
http://iec.ch/TC57/2013/CIM-schema-cim16#IdentifiedObject.description,description,http://iec.ch/TC57/2013/CIM-schema-cim16#IdentifiedObject,http://www.w3.org/2001/XMLSchema#string,The description is a free human readable text describing or naming the object. It may be non unique and may not correlate to a naming hierarchy.
http://iec.ch/TC57/2013/CIM-schema-cim16#RatioTapChanger.RatioTapChangerTable,RatioTapChangerTable,http://iec.ch/TC57/2013/CIM-schema-cim16#RatioTapChanger,http://iec.ch/TC57/2013/CIM-schema-cim16#RatioTapChangerTable,The tap ratio table for this ratio  tap changer.
http://iec.ch/TC57/2013/CIM-schema-cim16#TapChangerTablePoint.g,g,http://iec.ch/TC57/2013/CIM-schema-cim16#TapChangerTablePoint,http://www.w3.org/2001/XMLSchema#double,"The magnetizing branch conductance deviation as a percentage of nominal value. The actual conductance is calculated as follows:
calculated magnetizing conductance = g(nominal) * (1 + g(from this class)/100).   The g(nominal) is defined as the static magnetizing conductance on the associated power transformer end or ends.  This model assumes the star impedance (pi model) form."
http://iec.ch/TC57/2013/CIM-schema-cim16#Line.Region,Region,http://iec.ch/TC57/2013/CIM-schema-cim16#Line,http://iec.ch/TC57/2013/CIM-schema-cim16#SubGeographicalRegion,The sub-geographical region of the line.
http://iec.ch/TC57/2013/CIM-schema-cim16#PowerElectronicsConnection.minQ,minQ,http://iec.ch/TC57/2013/CIM-schema-cim16#PowerElectronicsConnection,http://www.w3.org/2001/XMLSchema#double,Minimum reactive power limit for the unit. This is the minimum (nameplate) limit for the unit.
http://iec.ch/TC57/2013/CIM-schema-cim16#ACDCConverter.valveU0,valveU0,http://iec.ch/TC57/2013/CIM-schema-cim16#ACDCConverter,http://www.w3.org/2001/XMLSchema#double,"Valve threshold voltage, also called Uvalve. Forward voltage drop when the valve is conducting. Used in loss calculations, i.e. the switchLoss depend on numberOfValves * valveU0."
http://iec.ch/TC57/2013/CIM-schema-cim16#RegularTimePoint.value1,value1,http://iec.ch/TC57/2013/CIM-schema-cim16#RegularTimePoint,http://www.w3.org/2001/XMLSchema#double,The first value at the time. The meaning of the value is defined by the derived type of the associated schedule.
http://iec.ch/TC57/2013/CIM-schema-cim16#DCConverterUnit.operationMode,operationMode,http://iec.ch/TC57/2013/CIM-schema-cim16#DCConverterUnit,http://www.w3.org/2001/XMLSchema#string,"The operating mode of an HVDC bipole (bipolar, monopolar metallic return, etc)."
http://iec.ch/TC57/2013/CIM-schema-cim16#ControlAreaGeneratingUnit.GeneratingUnit,GeneratingUnit,http://iec.ch/TC57/2013/CIM-schema-cim16#ControlAreaGeneratingUnit,http://iec.ch/TC57/2013/CIM-schema-cim16#GeneratingUnit,The generating unit specified for this control area.  Note that a control area should include a GeneratingUnit only once.
