property,label,domain,range,comment
http://iec.ch/TC57/2013/CIM-schema-cim16#RegulatingControl.Terminal,Terminal,http://iec.ch/TC57/2013/CIM-schema-cim16#RegulatingControl,http://iec.ch/TC57/2013/CIM-schema-cim16#Terminal,"The terminal associated with this regulating control.  The terminal is associated instead of a node, since the terminal could connect into either a topological node or a connectivity node.  Sometimes it is useful to model regulation at a terminal of a bus bar object. "
http://iec.ch/TC57/2013/CIM-schema-cim16#Equipment.EquipmentContainer,EquipmentContainer,http://iec.ch/TC57/2013/CIM-schema-cim16#Equipment,http://iec.ch/TC57/2013/CIM-schema-cim16#EquipmentContainer,Container of this equipment.
http://iec.ch/TC57/2013/CIM-schema-cim16#PhaseTapChangerLinear.xMin,xMin,http://iec.ch/TC57/2013/CIM-schema-cim16#PhaseTapChangerLinear,http://www.w3.org/2001/XMLSchema#double,"The reactance depends on the tap position according to a ""u"" shaped curve. The minimum reactance (xMin) appears at the mid tap position.  PowerTransformerEnd.x shall be consistent with PhaseTapChangerLinear.xMin and PhaseTapChangerNonLinear.xMin. In case of inconsistency, PowerTransformerEnd.x shall be used."
http://iec.ch/TC57/2013/CIM-schema-cim16#HydroGeneratingUnit.HydroPowerPlant,HydroPowerPlant,http://iec.ch/TC57/2013/CIM-schema-cim16#HydroGeneratingUnit,http://iec.ch/TC57/2013/CIM-schema-cim16#HydroPowerPlant,The hydro generating unit belongs to a hydro power plant.
http://iec.ch/TC57/2013/CIM-schema-cim16#RegulatingCondEq.RegulatingControl,RegulatingControl,http://iec.ch/TC57/2013/CIM-schema-cim16#RegulatingCondEq,http://iec.ch/TC57/2013/CIM-schema-cim16#RegulatingControl,The regulating control scheme in which this equipment participates.
http://iec.ch/TC57/2013/CIM-schema-cim16#GrossToNetActivePowerCurve.GeneratingUnit,GeneratingUnit,http://iec.ch/TC57/2013/CIM-schema-cim16#GrossToNetActivePowerCurve,http://iec.ch/TC57/2013/CIM-schema-cim16#GeneratingUnit,"A generating unit may have a gross active power to net active power curve, describing the losses and auxiliary power requirements of the unit."
http://iec.ch/TC57/2013/CIM-schema-cim16#Terminal.phases,phases,http://iec.ch/TC57/2013/CIM-schema-cim16#Terminal,http://www.w3.org/2001/XMLSchema#string,"Represents the normal network phasing condition. If the attribute is missing, three phases (ABC) shall be assumed, except for terminals of grounding classes (specializations of EarthFaultCompensator, GroundDisconnector, and Ground) which will be assumed to be N. Therefore, phase code ABCN is explicitly declared when needed, e.g. for star point grounding equipment.
The phase code on terminals connecting same ConnectivityNode or same TopologicalNode as well as for equipment between two terminals shall be consistent."
http://iec.ch/TC57/2013/CIM-schema-cim16#HydroGeneratingUnit.energyConversionCapability,energyConversionCapability,http://iec.ch/TC57/2013/CIM-schema-cim16#HydroGeneratingUnit,http://www.w3.org/2001/XMLSchema#string,Energy conversion capability for generating.
http://iec.ch/TC57/2013/CIM-schema-cim16#TapSchedule.TapChanger,TapChanger,http://iec.ch/TC57/2013/CIM-schema-cim16#TapSchedule,http://iec.ch/TC57/2013/CIM-schema-cim16#TapChanger,A TapSchedule is associated with a TapChanger.
http://iec.ch/TC57/2013/CIM-schema-cim16#ACDCConverter.baseS,baseS,http://iec.ch/TC57/2013/CIM-schema-cim16#ACDCConverter,http://www.w3.org/2001/XMLSchema#double,Base apparent power of the converter pole. The attribute shall be a positive value.
http://iec.ch/TC57/2013/CIM-schema-cim16#IdentifiedObject.shortName,shortName,http://iec.ch/TC57/2013/CIM-schema-cim16#IdentifiedObject,http://www.w3.org/2001/XMLSchema#string,The attribute is used for an exchange of a human readable short name with length of the string 12 characters maximum.
http://iec.ch/TC57/2013/CIM-schema-cim16#ThermalGeneratingUnit.CAESPlant,CAESPlant,http://iec.ch/TC57/2013/CIM-schema-cim16#ThermalGeneratingUnit,http://iec.ch/TC57/2013/CIM-schema-cim16#CAESPlant,A thermal generating unit may be a member of a compressed air energy storage plant.
http://iec.ch/TC57/2013/CIM-schema-cim16#DCGround.inductance,inductance,http://iec.ch/TC57/2013/CIM-schema-cim16#DCGround,http://www.w3.org/2001/XMLSchema#double,Inductance to ground.
http://iec.ch/TC57/2013/CIM-schema-cim16#Cut.lengthFromTerminal1,lengthFromTerminal1,http://iec.ch/TC57/2013/CIM-schema-cim16#Cut,http://www.w3.org/2001/XMLSchema#double,"The length to the place where the cut is located starting from side one of the cut line segment, i.e. the line segment Terminal with sequenceNumber equal to 1."
http://iec.ch/TC57/2013/CIM-schema-cim16#BoundaryPoint.toEndNameTso,toEndNameTso,http://iec.ch/TC57/2013/CIM-schema-cim16#BoundaryPoint,http://www.w3.org/2001/XMLSchema#string,"Identifies the name of the transmission system operator, distribution system operator or other entity at which the ""To"" side of the interconnection is connected to. The length of the string is 64 characters maximum."
http://iec.ch/TC57/2013/CIM-schema-cim16#PowerTransformerEnd.connectionKind,connectionKind,http://iec.ch/TC57/2013/CIM-schema-cim16#PowerTransformerEnd,http://www.w3.org/2001/XMLSchema#string,Kind of connection.
http://iec.ch/TC57/2013/CIM-schema-cim16#EquivalentBranch.x21,x21,http://iec.ch/TC57/2013/CIM-schema-cim16#EquivalentBranch,http://www.w3.org/2001/XMLSchema#double,"Reactance from terminal sequence 2 to terminal sequence 1. Used for steady state power flow. This attribute is optional and represents an unbalanced network such as off-nominal phase shifter. If only EquivalentBranch.x is given, then EquivalentBranch.x21 is assumed equal to EquivalentBranch.x.
Usage rule: EquivalentBranch is a result of network reduction prior to the data exchange."
http://iec.ch/TC57/2013/CIM-schema-cim16#EnergyConsumer.qfixed,qfixed,http://iec.ch/TC57/2013/CIM-schema-cim16#EnergyConsumer,http://www.w3.org/2001/XMLSchema#double,"Reactive power of the load that is a fixed quantity and does not vary as load group value varies. Load sign convention is used, i.e. positive sign means flow out from a node."
http://iec.ch/TC57/2013/CIM-schema-cim16#OperationalLimitType.acceptableDuration,acceptableDuration,http://iec.ch/TC57/2013/CIM-schema-cim16#OperationalLimitType,http://www.w3.org/2001/XMLSchema#double,"The nominal acceptable duration of the limit. Limits are commonly expressed in terms of the time limit for which the limit is normally acceptable. The actual acceptable duration of a specific limit may depend on other local factors such as temperature or wind speed. The attribute has meaning only if the flag isInfiniteDuration is set to false, hence it shall not be exchanged when isInfiniteDuration is set to true."
http://iec.ch/TC57/2013/CIM-schema-cim16#RegularIntervalSchedule.endTime,endTime,http://iec.ch/TC57/2013/CIM-schema-cim16#RegularIntervalSchedule,https://schema.org/DateTime,"The time for the last time point.  The value can be a time of day, not a specific date."
http://iec.ch/TC57/2013/CIM-schema-cim16#VoltageLevel.BaseVoltage,BaseVoltage,http://iec.ch/TC57/2013/CIM-schema-cim16#VoltageLevel,http://iec.ch/TC57/2013/CIM-schema-cim16#BaseVoltage,The base voltage used for all equipment within the voltage level.
http://iec.ch/TC57/2013/CIM-schema-cim16#EquivalentBranch.x,x,http://iec.ch/TC57/2013/CIM-schema-cim16#EquivalentBranch,http://www.w3.org/2001/XMLSchema#double,Positive sequence series reactance of the reduced branch.
http://iec.ch/TC57/2013/CIM-schema-cim16#GeneratingUnit.ratedGrossMaxP,ratedGrossMaxP,http://iec.ch/TC57/2013/CIM-schema-cim16#GeneratingUnit,http://www.w3.org/2001/XMLSchema#double,"The unit's gross rated maximum capacity (book value).
The attribute shall be a positive value."
http://iec.ch/TC57/2013/CIM-schema-cim16#AuxiliaryEquipment.Terminal,Terminal,http://iec.ch/TC57/2013/CIM-schema-cim16#AuxiliaryEquipment,http://iec.ch/TC57/2013/CIM-schema-cim16#Terminal,The Terminal at the equipment where the AuxiliaryEquipment is attached.
http://iec.ch/TC57/2013/CIM-schema-cim16#Switch.ratedCurrent,ratedCurrent,http://iec.ch/TC57/2013/CIM-schema-cim16#Switch,http://www.w3.org/2001/XMLSchema#double,"The maximum continuous current carrying capacity in amps governed by the device material and construction.
The attribute shall be a positive value."
http://iec.ch/TC57/2013/CIM-schema-cim16#DCGround.r,r,http://iec.ch/TC57/2013/CIM-schema-cim16#DCGround,http://www.w3.org/2001/XMLSchema#double,Resistance to ground.
http://iec.ch/TC57/2013/CIM-schema-cim16#ACDCConverter.maxP,maxP,http://iec.ch/TC57/2013/CIM-schema-cim16#ACDCConverter,http://www.w3.org/2001/XMLSchema#double,"Maximum active power limit. The value is overwritten by values of VsCapabilityCurve, if present."
http://iec.ch/TC57/2013/CIM-schema-cim16#RatioTapChanger.stepVoltageIncrement,stepVoltageIncrement,http://iec.ch/TC57/2013/CIM-schema-cim16#RatioTapChanger,http://www.w3.org/2001/XMLSchema#double,"Tap step increment, in per cent of rated voltage of the power transformer end, per step position.
When the increment is negative, the voltage decreases when the tap step increases."
http://iec.ch/TC57/2013/CIM-schema-cim16#AsynchronousMachine.nominalSpeed,nominalSpeed,http://iec.ch/TC57/2013/CIM-schema-cim16#AsynchronousMachine,http://www.w3.org/2001/XMLSchema#double,Nameplate data.  Depends on the slip and number of pole pairs.
http://iec.ch/TC57/2013/CIM-schema-cim16#ShuntCompensator.aVRDelay,aVRDelay,http://iec.ch/TC57/2013/CIM-schema-cim16#ShuntCompensator,http://www.w3.org/2001/XMLSchema#double,An automatic voltage regulation delay (AVRDelay) which is the time delay from a change in voltage to when the capacitor is allowed to change state. This filters out temporary changes in voltage.
http://iec.ch/TC57/2013/CIM-schema-cim16#PhaseTapChangerNonLinear.xMin,xMin,http://iec.ch/TC57/2013/CIM-schema-cim16#PhaseTapChangerNonLinear,http://www.w3.org/2001/XMLSchema#double,"The reactance depend on the tap position according to a ""u"" shaped curve. The minimum reactance (xMin) appear at the mid tap position.   PowerTransformerEnd.x shall be consistent with PhaseTapChangerLinear.xMin and PhaseTapChangerNonLinear.xMin. In case of inconsistency, PowerTransformerEnd.x shall be used."
http://iec.ch/TC57/2013/CIM-schema-cim16#ACDCConverter.minUdc,minUdc,http://iec.ch/TC57/2013/CIM-schema-cim16#ACDCConverter,http://www.w3.org/2001/XMLSchema#double,The minimum voltage on the DC side at which the converter should operate. It is converter’s configuration data used in power flow. The attribute shall be a positive value.
http://iec.ch/TC57/2013/CIM-schema-cim16#BasicIntervalSchedule.value1Unit,value1Unit,http://iec.ch/TC57/2013/CIM-schema-cim16#BasicIntervalSchedule,http://www.w3.org/2001/XMLSchema#string,Value1 units of measure.
http://iec.ch/TC57/2013/CIM-schema-cim16#GeneratingUnit.maxOperatingP,maxOperatingP,http://iec.ch/TC57/2013/CIM-schema-cim16#GeneratingUnit,http://www.w3.org/2001/XMLSchema#double,This is the maximum operating active power limit the dispatcher can enter for this unit.
http://iec.ch/TC57/2013/CIM-schema-cim16#VsConverter.CapabilityCurve,CapabilityCurve,http://iec.ch/TC57/2013/CIM-schema-cim16#VsConverter,http://iec.ch/TC57/2013/CIM-schema-cim16#VsCapabilityCurve,Capability curve of this converter.
http://iec.ch/TC57/2013/CIM-schema-cim16#EquivalentInjection.ReactiveCapabilityCurve,ReactiveCapabilityCurve,http://iec.ch/TC57/2013/CIM-schema-cim16#EquivalentInjection,http://iec.ch/TC57/2013/CIM-schema-cim16#ReactiveCapabilityCurve,The reactive capability curve used by this equivalent injection.
